{
  "schema_version": 1,
  "phase_id": "S0",
  "phase_label": "Foundation Calibration",
  "project_status": "published_archive",
  "current_experiment": "JW-LTBF-04",
  "current_experiment_label": "最新完整记录",
  "completed_experiments": 4,
  "documented_experiments": 4,
  "planned_atlas_frames": 14,
  "public_atlas_frames": 3,
  "generated_images": 82,
  "documents": 4,
  "last_research_update": "2026-07-23",
  "status_updated_at": "2026-07-29",
  "next_step": "完成 14 张母图的公开权限与衍生图清点，再开放完整 Contact Sheet。",
  "public_boundary": "当前网页公开四份完整实验记录，以及 S0-02 的三张 A/B/C 对比图；其余母图和内部工作图尚未公开。",
  "preview_images": [
    {
      "id": "A",
      "label": "A / 基线",
      "src": "assets/works/mirror-plan/s0-02-a.jpg",
      "alt": "镜场计划 S0-02 A 版视觉校准结果"
    },
    {
      "id": "B",
      "label": "B / 当前选择",
      "src": "assets/works/mirror-plan/s0-02-b.jpg",
      "alt": "镜场计划 S0-02 B 版视觉校准结果"
    },
    {
      "id": "C",
      "label": "C / 变量对照",
      "src": "assets/works/mirror-plan/s0-02-c.jpg",
      "alt": "镜场计划 S0-02 C 版视觉校准结果"
    }
  ]
}
